{
  "schemaVersion": 2,
  "sourceId": "jeremylongshore-plugins-plus-skills",
  "repository": "https://github.com/jeremylongshore/claude-code-plugins-plus-skills",
  "queryUrls": [
    "https://github.com/jeremylongshore/claude-code-plugins-plus-skills"
  ],
  "reportedCountClaims": [],
  "markdownIndexPaths": []
}
